sentence,difficulty
"Weniger bekannt ist, dass in der Zeit des Nationalsozialismus die Türkei die Rettung für mehrere hundert Deutsche wurde .",B2
Der Historiker und Türkei-Experte Rasim Marz sagt: „Die Türkei […] wurde zur Zufluchtsstätte für viele verfolgte Akademiker .,B2
"“ Dort waren sie maßgeblich daran beteiligt , den Staat nach europäischem Vorbild weiter auszubauen , so Marz.",B2
Heute ist das Verhältnis zwischen Deutschland und der Türkei schwierig.,B2
"Seit Recep Tayyip Erdoğan im Jahr 2014 Präsident des Landes wurde, wird von der deutschen Regierung vor allem die Menschenrechtslage in der Türkei kritisiert.",B2
Auch die Haltung Erdoğans zur Terrororganisation Hamas ist für Berlin nicht akzeptabel .,B2
2005 hatte sich Deutschland noch für einen möglichen EU-Beitritt der Türkei eingesetzt.,B2
Im Moment ist das kein Thema mehr.,B1
In fast allen europäischen Ländern darf man auf Autobahnen nicht schneller als 130 Stundenkilometer fahren.,B2
Nur in Deutschland gilt meistens: freie Fahrt für alle.,B1
Viele Menschen sind damit jedoch nicht einverstanden.,B1
Braucht Deutschland ein allgemeines Tempolimit ?,B1
In fast allen europäischen Ländern darf man auf Autobahnen nicht schneller als 130 Stundenkilometer fahren.,B2
Nur in Deutschland gilt meistens: freie Fahrt für alle.,B1
Viele Menschen sind damit jedoch nicht einverstanden.,B1
Deutschlands Autobahnen sind in Europa eine Ausnahme.,A2
"Fast überall sonst gelten Tempolimits von 110, 120 oder 130 Kilometern pro Stunde.",B1
"Nur in Deutschland darf man grundsätzlich so schnell fahren, wie man will – abgesehen von streckenweisen Geschwindigkeitsbegrenzungen, die es auf 30 Prozent der Autobahnabschnitte gibt.",B2
Für das Rasen auf deutschen Autobahnen wird im Ausland sogar Werbung gemacht.,B2
In Deutschland ist das Thema jedoch stark umstritten .,B2
Inzwischen ist zwar eine Mehrheit der Menschen für ein allgemeines Tempolimit auf Autobahnen.,B2
"Aber bisher sind alle Versuche gescheitert , ein solches Gesetz einzuführen – auch die aktuelle Bundesregierung wurde sich nicht einig .",B2
"Vor allem die Mitglieder konservativer Parteien, junge Männer und Vielfahrer lehnen es ab.",B2
Man könnte so fast drei Prozent der Emissionen im Straßenverkehr einsparen .,B2
"Denn je langsamer ein Auto fährt, desto weniger Schadstoffe stößt es aus .",B2
Wegen des kürzeren Bremswegs könnten bis zu 70 Prozent der Unfälle verhindert werden.,B2
Außerdem würde es weniger Staus und Lärm geben.,B1
"Doch viele Gegner des Tempolimits sind der Meinung, dass es der Umwelt zu wenig nützt; die Einschränkungen sind ihnen dagegen zu groß.",B2
"Der Allgemeine Deutsche Automobil-Club (ADAC) verweist auf die Unfallzahlen, die in Deutschland nicht höher sind als in Ländern mit Tempolimit.",B2
"Das heißt allerdings nicht, dass ein hohes Tempo automatisch sicher ist.",B2
Denn schon jetzt fahren über drei Viertel der Menschen in Deutschland freiwillig weniger als 130 km/h – aus Vorsicht.,B2
Der Klimawandel sorgt für immer härtere Bedingungen auf dem höchsten Berg der Erde.,B2
Trotz der großen Gefahren versuchen hunderte Menschen jedes Jahr den Aufstieg.,B2
Unter dem Tourismus leidet auch die Natur.,B1
Schnee schmelze auf dem Mount Everest Der Klimawandel sorgt für immer härtere Bedingungen auf dem höchsten Berg der Erde.,B2
Trotz der großen Gefahren versuchen hunderte Menschen jedes Jahr den Aufstieg .,B2
Unter dem Tourismus leidet auch die Natur.,B1
Fast 8850 Meter ragt der Mount Everest an der Grenze zwischen China und Nepal in die Höhe .,B2
"Und viele träumen davon, einmal auf seinem Gipfel zu stehen.",A2
"Jedes Jahr versuchen hunderte Menschen aus aller Welt, auf den höchsten Berg der Erde zu steigen.",B1
Immer mehr Genehmigungen für den Aufstieg wurden in den letzten Jahren erteilt – und immer mehr Menschen starben bei dem Versuch.,B2
"2023 waren es 18, ein trauriger Rekord.",B1
"Auf dem Mount Everest herrschen extreme Bedingungen: Man kann kaum atmen, die Kälte ist groß.",B2
Doch der Klimawandel macht den Berg noch gefährlicher.,B1
"Schon seit Jahren schneit es auf dem Everest immer weniger, die Gletscher schmelzen.",B2
"Dadurch kommt Bewegung ins ewige Eis, was für Bergsteigerinnen und Bergsteiger und auch für die Bevölkerung vor Ort lebensbedrohlich ist: „Viele Menschen verlieren ihr Leben durch Lawinenabgänge “, sagt Glaziologe Tenzing Chogyal Sherpa.",B2
"Jedes Jahr vor Beginn der Klettersaison im Mai prüfen Spezialisten die Bedingungen auf dem Berg, um einen möglichst sicheren Weg für die Kletterteams zu finden.",B2
Doch das wird immer komplizierter.,B1
So müssen die Teams in der aktuellen Saison an einem instabilen Hängegletscher vorbei.,B2
2014 starben dort 16 Menschen in einer Eislawine.,B1
Zum Schutz von Umwelt und Menschen haben die Regierungen Chinas und Nepals jetzt neue Regeln für den Aufstieg beschlossen.,B2
So soll es von chinesischer Seite nur noch höchstens 300 Klettergenehmigungen pro Saison geben.,B2
"Und wer von Nepal aus auf den Gipfel klettern will, muss ab jetzt spezielle Kot beutel verwenden.",B2
Denn der Berg ist inzwischen übersät mit dem Müll und den Hinterlassenschaften früherer Bergsteiger – und stinkt furchtbar.,B2
Die Karapanã nutzen Pfeil und Bogen schon lange.,B1
Eine Angehörige des Volkes trainiert nun als Bogenschützin für die Olympischen Spiele in Paris.,B2
"Viele Indigene bringen großes sportliches Potenzial mit, sagt sie.",B2
Als Indigene zu Olympia Die Karapanã nutzen Pfeil und Bogen schon lange.,B2
Eine Angehörige des Volkes trainiert nun als Bogen schützin für die Olympischen Spiele in Paris.,B2
"Viele Indigene bringen großes sportliches Potenzial mit, sagt sie.",B2
Graziela Santos ist Bogenschützin und gehört zum Volk der Karapanã.,B1
Als erste Indigene überhaupt möchte sie bei den Olympischen Spielen für Brasilien starten.,B2
"„Das ist ein historischer Meilenstein für uns alle“, sagt sie.",B1
"In Basilien leben rund 1,7 Millionen Indigene, das entspricht etwa 0,8 Prozent der Gesamtbevölkerung.",B1
Santos ist wie ihr Bruder Gustavo Mitglied der Nationalmannschaft.,B1
"Zum Bogenschießen als Sport kamen sie durch ein Förder projekt der Stiftung Nachhaltiger Amazonas (FAS), das junge indigene Bogenschützinnen und Bogenschützen unterstützt.",B2
"„Dieser Sport stammt ja aus unserer alten Kultur, denn wir benutzen Pfeil und Bogen seit langer Zeit“, so Santos.",B2
"Sie glaubt, dass indigene Sportlerinnen und Sportler viele Sportarten besonders schnell lernen können: „Wir machen alles.",B2
"Wir laufen, wir schwimmen, wir schießen mit Pfeil und Bogen, wir jagen , wir fischen .",B1
Wir haben eine großartige motorische Koordination .,B2
"In einer TV-Show gewannen Mitglieder der FAS Geld, um ein Trainingszentrum für Bogenschützinnen und -schützen im Amazonasgebiet zu bauen.",B2
"Santos erklärt: „Wir kommen aus Dörfern und Gemeinden, die weit von Manaus entfernt sind.",A2
"“ Oft fehlt das Geld, um in der Stadt zu leben, dort ein gutes Trainingslager zu besuchen und sich wie Hochleistungssportlerinnen und -sportler zu ernähren.",B2
"„Der Bau wird dazu führen , dass große Talente entdeckt werden, die wir in unserem Volk haben, und es ist wichtig, dass diese jungen Menschen ihre Heimat nicht früh verlassen, sondern in der Nähe ihrer Familien bleiben“, so Santos.",B2
"Sie glaubt: „Wir werden mehr Hochleistungssportler haben, die indigene Völker repräsentieren .",B2
"Beleidigungen, Bedrohungen, körperliche Angriffe: Politikerinnen und Politiker in Deutschland müssen immer häufiger um ihre Sicherheit fürchten.",B2
Einige denken bereits ans Aufhören.,B1
Das ist eine Gefahr für die Demokratie.,B1
"Gewalt gegen Politikerinnen und Politiker nimmt zu Beleidigungen, Bedrohungen , körperliche Angriffe : Politikerinnen und Politiker in Deutschland müssen immer häufiger um ihre Sicherheit fürchten.",B2
Einige denken bereits ans Aufhören.,B1
Das ist eine Gefahr für die Demokratie.,B1
Matthias Ecke hat die Operation zum Glück gut überstanden : Der sozialdemokratische Politiker war während des Wahlkampfes für die Europa-Wahl 2024 angegriffen worden und hatte Knochenbrüche im Gesicht erlitten .,B2
Die Angreifer: vier wahrscheinlich rechtsextreme junge Männer.,B2
"Wer in Deutschland politisch aktiv ist, lebt gefährlich.",B2
Tag für Tag werden Politikerinnen und Politiker bedroht und beschimpft .,B2
"Max Reschke, Parteichef der Grünen in Thüringen, berichtet von Misthaufen vor der Tür, kaputten Fenstern und gesprengten Briefkästen.",B2
"„Es wird auch gerne versucht, die Familien einzuschüchtern “, erzählt er.",B1
"Andere würden solche Gedanken auch in Handlungen umsetzen , so Reschke.",B2
"In Essen wurden am 2. Mai zwei Politiker der Grünen angegriffen, einer von ihnen verletzt.",B2
Einen Tag später folgte der Angriff auf Matthias Ecke.,B1
Und am 7. Mai wurde Franziska Giffey (SPD) in Berlin verletzt.,B1
Eine Mitschuld für die zunehmende Gewalt sehen viele bei der mindestens in Teilen rechtsextremen AfD.,B2
Allerdings werden auch deren Mitglieder angegriffen.,B2
"Sven Tetzlaff von der Körber-Stiftung ist überzeugt, dass die Verrohung der Sprache mit den sozialen Medien zu tun hat.",B2
"Damit sinkt auch die Hemmschwelle , physisch anzugreifen, glaubt er.",B2
Einen weiteren Grund sieht er in einer abnehmenden Kompromissbereitschaft .,B2
"Viele würden stark auf ihre eigenen Interessen pochen und dann Verantwortliche beleidigen, die diese Interessen nicht umsetzen.",B2
"Als Folge der häufigen Angriffe denken immer mehr Betroffene darüber nach, sich aus der Politik zurückzuziehen .",B2
Das ist gefährlich für die Demokratie.,B1
"„Wenn wir vor Ort kein Vertrauen mehr haben, dass dieser demokratische Staat weiterhin funktioniert, haben wir in Deutschland wirklich ein massives Problem“, so Tetzlaff.",B2
China hat großen Einfluss auf seine Bürger – auch über die Grenzen hinaus.,B1
"Studierende, die im Ausland für Demokratie demonstrieren, werden beobachtet und bedroht.",B2
Auch auf ihre Familien wird Druck ausgeübt.,B2
Überwachung von chinesischen Auslandsstudierenden China hat großen Einfluss auf seine Bürger – auch über die Grenzen hinaus.,B2
"Studierende, die im Ausland für Demokratie demonstrieren, werden beobachtet und bedroht .",B2
Auch auf ihre Familien wird Druck ausgeübt .,B2
"Rowan hatte niemandem gesagt, wie sie hieß oder wohin sie ging.",B1
"Die Chinesin, deren echter Name und Wohnort hier zu ihrer Sicherheit geheim bleiben, studiert im Ausland.",B2
Dort nahm sie an einer Veranstaltung zum Gedenken an das Tiananmen-Massaker vom 4. Juni 1989 teil.,B2
"Es dauerte nur wenige Stunden, bis sich ihr Vater aus China bei ihr meldete.",B2
"Staatliche Sicherheitsbeamte hätten ihm gesagt, dass er Rowan von ihrem Engagement abhalten soll.",B2
"Viele der rund 900. 000 chinesischen Auslandsstudierenden erleben aktuell ähnliche Dinge, so die Menschenrechtsorganisation Amnesty International.",B2
In Peking will man das Ansehen des Einparteienstaats schützen – und kritische Demonstrationen auch im Ausland verhindern.,B2
Besonders deutlich wird das vor Ereignissen wie dem Besuch des chinesischen Präsidenten Xi Jinping in Paris.,B2
"Chinesische Studierende berichten: Wer Demonstrationen organisieren will, wird gezielt bedroht.",B2
"Laut Theresa Bergmann von Amnesty International Deutschland übt der Staat auch Druck auf die Familien in China aus: „Es wird zum Beispiel damit gedroht, Pässe einzuziehen , Arbeitsstellen zu kündigen, Renten zu kürzen oder Bildungsmöglichkeiten einzuschränken .",B2
"“ Ein weiteres Mittel zur Überwachung scheint die App WeChat zu sein, die die Daten von Nutzerinnen und Nutzern an die Regierung in Peking weitergibt.",B2
"Doch wer sich aus dem Ausland bei seiner Familie in China melden möchte, ist auf solche Apps angewiesen – andere sind oft nicht erlaubt.",B2
"Für Studierende ist der staatliche Druck besonders gefährlich, so Bergmann – denn sie dürfen in der Regel nur vorübergehend an ihrem Studienort bleiben und sind finanziell abhängig.",B2
Trotzdem sprechen nun 32 Studierende aus acht europäischen und nordamerikanischen Studienländern in einem Bericht von Amnesty International über die Überwachung.,B2
Ihre Aussagen sind sehr ähnlich.,B1
Doch die chinesischen Behörden schweigen bisher zu den Vorwürfen oder dementieren sie.,B2
"Die Deutschen haben den Ruf, sehr fleißig zu sein.",B1
Demnach arbeiten Deutsche viel weniger als andere.,B2
Sind sie jetzt faul geworden?,B1
Ist die Arbeitsmoral der Deutschen gesunken?,B1
"Die Deutschen haben den Ruf , sehr fleißig zu sein.",B1
Demnach arbeiten Deutsche viel weniger als andere.,B2
Sind sie faul geworden?,B1
International gilt der Deutsche als Arbeitstier .,B2
Im Jahr 2022 hat der durchschnittliche Deutsche nur 1340 Stunden gearbeitet.,B1
Das liegt deutlich unter dem Durchschnitt der Europäischen Union mit 1570 Stunden und ist weit entfernt von 1810 Stunden in den USA.,B2
Sieht es mit der Arbeitsmoral der Deutschen so schlecht aus?,B2
"Nein, sagt Arbeitsmarktexperte Enzo Weber: „Die Zahlen bedeuten … nicht, dass in Deutschland weniger gearbeitet wird.",B2
"Ganz im Gegenteil, es wird mehr gearbeitet.",B1
“ Wie kann das sein?,A1
"„Deutschland hat eine sehr hohe Frauenerwerbsquote im Vergleich zu den meisten anderen Ländern“, erklärt er.",B2
Sie liegt bei 77 Prozent.,B1
"Doch Frauen arbeiten häufig in Teilzeit, und das drückt die durchschnittliche Jahresarbeitszeit pro Person nach unten .",B2
"Tatsache ist allerdings, dass die Deutschen gern weniger arbeiten möchten.",B2
"„Ich glaube, alle wollen möglichst viel Freizeit und hohe Gehälter haben”, so Enzo Weber.",B1
"Ein Wunsch, den auch schon frühere Generationen hatten.",B1
Doch die Lebensmodelle der Deutschen haben sich verändert: Oft arbeiten beide Partner und brauchen daher mehr Flexibilität .,B1
"„Jeder sollte frei wählen können, in welchem Lebensabschnitt er wie viel arbeitet"", meint Weber daher.",B2
"Wie aber passt der Wunsch, weniger zu arbeiten, mit dem Wunsch zusammen, den Wohlstand im Land zu sichern?",B2
Laut Enzo Weber muss die Produktivität erhöht werden: durch Fortbildungen und mehr Digitalisierung .,B2
"Außerdem müssen Deutsche ohne Schul- oder Berufsabschluss und Migrantinnen und Migranten für den Arbeitsmarkt fit gemacht werden, um etwas gegen Fachkräftemangel zu tun.",B2
"Ob das klappt, wird die Zukunft zeigen.",B1
"Das EU-Parlament sitzt in Brüssel, für viele Bürger scheint das zu weit weg.",B1
Sie gehen lieber zur Bundestagswahl als zur Europawahl.,B1
Dabei hat die EU direkten Einfluss auf das Leben in Deutschland.,B2
"Keine Lust auf Europawahl Das EU-Parlament sitzt in Brüssel, für viele Bürger scheint das zu weit weg.",B2
Sie gehen lieber zur Bundestagswahl als zur Europawahl.,B1
Dabei hat die EU direkten Einfluss auf das Leben in Deutschland.,B2
"Alle fünf Jahre laden Politikerinnen und Politiker, die für die Europawahl kandidieren , zu Wahlveranstaltungen ein.",B2
Doch das Interesse der Bürgerinnen und Bürger ist gering.,B1
"„Eine Bundestagswahl, wo man das Gefühl hat, mitzuentscheiden, wer der Kanzler wird, das zieht einfach mehr "", sagt der ostdeutsche Politiker Kurt Fischer.",B2
Katharina Barley ist Vizepräsidentin der EU.,B1
Zu einer ihrer Wahlveranstaltungen in Ostdeutschland kommen gerade mal 20 Leute.,B2
"Und über das Thema, wie man die Demokratie in der EU weiter stärken kann, wollen die Teilnehmer gar nicht mit ihr reden.",B2
"Sie beschäftigt eher, warum der öffentliche Nahverkehr nicht besser ausgebaut wird oder was man gegen die vielen Wölfe in der Region tun kann.",B2
Viele solcher Fragen werden im EU-Parlament entschieden.,B2
Laut EU-Recht sind Wölfe eine geschützte Art .,B1
"Und manchmal gibt es Geld aus Brüssel, um das Schienennetz auszubauen.",B1
Die Verbindung zum Alltag der Menschen ist also da.,B1
Das Thema Asyl zum Beispiel sehen die Deutschen als größte Herausforderung für Deutschland und Europa.,B2
Trotzdem interessieren sich laut einer Umfrage 48 Prozent der Deutschen wenig oder gar nicht für die Europawahl.,B2
"offene Grenzen, Reisefreiheit, wirtschaftlicher Wohlstand – und vor allem Frieden.",B2
"„Ein hohes Gut … angesichts dessen , was außerhalb der EU stattfindet“, so Söder.",B2
"Er weiß aus Erfahrung: Bei einer Europawahl erreicht man die Bevölkerung am besten, wenn man zuerst nach Herausforderungen im eigenen Land fragt – und diese dann zu europäischen Themen macht.",B2
In Deutschland wird über die Form der Erinnerungskultur gestritten.,B2
"Während einige die Opfer des Kolonialismus sichtbarer machen möchten, machen sich andere Sorgen um die Bedeutung des Holocaust-Gedenkens.",B2
Erinnerungskultur – Streit um geplante Reform In Deutschland wird über die Form der Erinnerungskultur gestritten.,B2
"Während einige die Opfer des Kolonialismus sichtbarer machen möchten, machen sich andere Sorgen um die Bedeutung des Holocaust - Gedenkens .",B2
Der Holocaust war ein beispielloses Verbrechen in Deutschland.,B2
Seit Jahrzehnten wird der Opfer des Nationalsozialismus gedacht.,B2
"Doch wie kann man an andere Opfer von Verbrechen erinnern, die zum Beispiel in der deutschen Kolonialzeit begangen wurden?",B2
"Anfang 2024 veröffentlichte die Bundes beauftragte für Kultur einen Entwurf für eine Reform der Erinnerungskultur – einschließlich der Geschichte des Nationalsozialismus, der DDR, des Kolonialismus, der Demokratie und der Migration.",C1
Doch daran gab es Kritik.,B2
"In einem offenen Brief der Holocaust-Gedenkstätten steht zum Beispiel, dass der Entwurf die zentrale Bedeutung des „Menschheitsverbrechens der Shoah“ für Deutschland nicht deutlich macht und daher „im Sinne der Verharmlosung der NS-Verbrechen verstanden werden“ könnte.",C1
"Dies hat dazu geführt, dass der Entwurf von der Webseite genommen wurde.",B2
Tahir Della von der Initiative Schwarzer Menschen in Deutschland (ISD) begrüßt die Einbeziehung der Kolonialgeschichte in die Erinnerungskultur.,B2
"Ihm ist dabei auch der Austausch zwischen seiner Initiative, den Holocaust-Gedenkstätten, denen für Sinti und Roma und des DDR-Systems wichtig.",C1
"Er möchte aber auch die koloniale Kontinuität zeigen, „die über die Kolonialzeit hinaus in die NS-Zeit hineinreicht .",B2
“ Der Holocaust wird in Deutschland häufig als Zivilisationsbruch beschrieben.,B2
"Die postkoloniale Kritik argumentiert, dass bereits die Kolonialgeschichte rassistisch und voller Gewalt war.",C1
In Deutschland schließt sie den Völkermord an den Herero und Nama (1904 – 1908) im heutigen Namibia ein.,B2
"Sebastian Conrad, Professor für globale und postkoloniale Geschichte, meint: „Die globalisierte Welt, in der wir leben, hat eine längere Geschichte.",B2
“ Und in dieser spielt der Kolonialismus eine wichtige Rolle.,B2
"Ihn zu verstehen, ist daher für das Verständnis der Gegenwart wichtig, so Conrad.",B2
"Sie produzieren lustige Videos, nutzen die sozialen Medien und sind auf Dorffesten präsent: Rechtsextreme versuchen mit Absicht, die Menschen dort zu erreichen, wo sie sich zu Hause fühlen und nicht an Politik denken.",B2
"Harmlosigkeit als rechtsextreme Strategie Sie produzieren lustige Videos, nutzen die sozialen Medien und sind auf Dorffesten präsent: Rechtsextreme versuchen mit Absicht, die Menschen dort zu erreichen, wo sie sich zu Hause fühlen und nicht an Politik denken.",B2
In einer hippen Bar auf der Insel Sylt werden rassistische Parolen gerufen – zu dem Lied „L‘ amour toujours“ von Gigi D’Agostino.,B2
"Auf Tiktok erscheint ein Video von der Szene, der Fall sorgt bundesweit für Aufsehen .",B2
"Weitere Partyvideos werden bekannt – dieselben Parolen, dasselbe Lied.",B2
Laut der Amadeu Antonio Stiftung gehört es seit 2023 zum Soundtrack einer neuen Generation von Rechtsextremen.,B2
Die Fälle zeigen: Rechtes Gedankengut dringt immer weiter bis in die Mitte der Gesellschaft vor.,B2
Wie konnte es so weit kommen?,B1
In den 2010er-Jahren hat die „Neue Rechte“ das alte Image des Nazis mit Glatze und schweren Stiefeln abgelegt .,B2
"Statt sich durch eine rechte Subkultur abzugrenzen , will die „Neue Rechte“ die existierende Jugendkultur nutzen.",C1
Den Anfang machte die Identitäre Bewegung (IB) mit ihren professionell produzierten Online-Videos.,B2
Sie wird inzwischen vom deutschen Verfassungsschutz als „gesichert rechtsextrem“ eingestuft .,B2
"Doch ihre Methode, sich an die bestehende Jugendkultur anzuschließen, wird heute von vielen Rechten systematisch genutzt.",B2
Besonders die sozialen Medien spielen dabei eine große Rolle.,B1
Auch vor Ort werden rechte Ideen verbreitet – zum Beispiel auf Dorffesten oder beim Kaffee- und Würstchenverkauf.,B2
"Als „Metapolitik“ wird diese Strategie in der rechten Rhetorik bezeichnet: Die Menschen sollen dort beeinflusst werden, wo sie sich zu Hause fühlen und unter sich sind.",B2
So entsteht ein Wir-Gefühl.,B2
"„Mithilfe dieser Metapolitik wird unauffällig rechtes Gedankengut zu den Menschen gebracht“, sagt Lorenz Blumenthaler von der Amadeu Antonio Stiftung.",B2
"Erst wirkt alles unpolitisch und harmlos, „aber so schaffen sie es, langsam in die Köpfe der Menschen einzudringen und ihre Ideologie dort zu platzieren “, so Blumenthaler.",B2
"Ein über 20 Jahre altes, fröhliches Lied, dessen Macher nichts mit rechtem Gedankengut zu tun hat, wird gerade wegen seiner Harmlosigkeit für rechtsextreme Propaganda genutzt.",B2
Sie ist die verbreitetste Kakerlake weltweit.,B1
"In Gebäuden findet die Deutsche Schabe gute Lebensbedingungen, und es ist schwer, sie wieder loszuwerden.",B2
"Eine Studie zeigt, was das kleine Insekt so erfolgreich macht.",B1
Die Deutsche Schabe : eine Erfolgsgeschichte Sie ist die verbreitetste Kakerlake weltweit.,A2
"In Gebäuden findet die Deutsche Schabe gute Lebensbedingungen, und es ist schwer, sie wieder loszuwerden .",B2
"Eine Studie zeigt, was das kleine Insekt so erfolgreich macht.",B1
"Sie ist nachts unterwegs, sehr schnell und bis zu zwei Zentimeter groß: die Deutsche Schabe.",B2
Die meisten Menschen finden sie eklig – und zu Recht: Schaben übertragen Krankheiten und sind gefährlich für Mensch und Tier.,B2
"Doch sie loszuwerden ist nicht einfach: Sie kommen fast überall hin, denn sie können durch kleinste Ritzen laufen und Wände hochklettern.",B2
Wegen ihres starken Panzers kann man sie kaum zerdrücken .,B1
"Insektengifte helfen nicht viel, denn Schaben werden sehr schnell resistent und geben diese Resistenz an die nächste Generation weiter.",B2
"Den Namen „Deutsche Schabe“ hat die Kakerlake von dem Naturforscher Carl von Linné bekommen, der sie 1776 in Deutschland zum ersten Mal wissenschaftlich untersucht hat.",B2
"Woher sie eigentlich kommt, war lange nicht bekannt.",B2
"Eine Studie der Nationalen Universität von Singapur zeigt nun: Ihre Geschichte ist enger mit unserer verbunden, als uns wahrscheinlich lieb ist .",B2
"Denn in Asien hat die Schabe schon vor etwa 2100 Jahren menschliche Siedlungen als Lebensraum für sich entdeckt, so die Studie.",B2
Tatsächlich kommt sie in der freien Natur bis heute nicht vor.,B2
Vor etwa 1200 Jahren kam sie nach Europa.,B1
Mit dem Kolonialismus und weltweiten Handelsbeziehungen verbreitete sie sich dann über den Rest der Welt.,B2
Kakerlaken mögen es warm und feucht.,B1
"Häuser mit Heizungen und Wasserleitungen sind perfekt für sie, so können sie auch in kalten Gegenden leben.",B1
"„Der Aufstieg der menschlichen Zivilisation hat die Evolution und Verbreitung von Arten ausgelöst , die an städtische Umgebungen angepasst sind“, so die Studie.",C1
"Wir selbst sorgen also dafür, dass sich die Schabe bei uns wohlfühlt.",B2
Stottern ist für Betroffene oft sehr belastend.,B1
"Die Redeflussstörung beginnt meist früh, eine echte Heilung gibt es bis heute nicht.",B2
"Forschende könnten aber nun entdeckt haben, wo das Stottern entsteht.",B2
Kann Stottern bald geheilt werden?,B1
Stottern ist für Betroffene oft sehr belastend .,B1
"Die Redefluss störung beginnt meist früh, eine echte Heilung gibt es bis heute nicht.",B2
"Forschende könnten aber nun entdeckt haben, wo das Stottern entsteht.",B2
"Man weiß genau, was man sagen will, doch bei einem bestimmten Wort gerät der Redefluss ins Stocken : Stottern ist ein Problem, von dem viele Menschen betroffen sind.",B2
"Allein in Deutschland sind es etwa 800. 000, fast ein Prozent der Bevölkerung.",B1
Bei Kleinkindern ist der Anteil mit über fünf Prozent noch höher.,B2
Das Stottern beginnt meist plötzlich zwischen dem 2. und 6. Lebensjahr.,B1
Oft verschwindet es auch wieder von selbst.,B1
Andere Menschen dagegen stottern ihr ganzes Leben lang.,B1
"Früher galt Stottern als psychische Erkrankung , was inzwischen widerlegt ist.",B2
"Wer stottert, dessen Gehirn hat Schwierigkeiten, den Redefluss zu kontrollieren.",B2
"Forschende aus Finnland könnten nun herausgefunden haben, wo genau das Stottern entsteht.",B2
Sie entdeckten bei den Betroffenen in einem bestimmten Bereich des Gehirns Veränderungen in den neuronalen Knotenpunkten .,C1
Solche Veränderungen können bereits in der Kindheit oder auch erst im Erwachsenenalter etwa nach einem Schlaganfall auftreten .,B2
Neurologe Martin Sommer von der Universität Göttingen ist selbst vom Stottern betroffen.,B2
"Er erklärt: Stottern lässt sich zwar mit bestimmten Methoden kontrollieren, bisher aber nicht medizinisch heilen.",B2
"Er warnt vor unwirksamen Medikamenten oder Therapien: „Es gibt immer noch dubiose Behandlungsanbieter, die sozusagen Wunderheilung versprechen.",B2
Da muss man vorsichtig sein.,B1
“ Die Entdeckung aus Finnland aber könnte ein erster Schritt in Richtung neuer Therapiemöglichkeiten sein.,B2
"Eine wirksame Therapie würde das Leben vieler Betroffener leichter machen, denn sie leiden oft sehr unter dem Stottern.",B2
